{
  "schema_version": "1.0.0",
  "record_type": "application-test",
  "standard_kind": "component",
  "standard_id": "VCGF-UI-COMP-001",
  "acceptance_id": "VCGF-UI-COMP-001-AC01",
  "status": "not_run",
  "executed_at": null,
  "environment": null,
  "revision": null,
  "evidence_paths": [],
  "notes": "مثال لسجل اختبار لم ينفذ، ولا يثبت تنفيذ المكوّن أو النمط أو تركيب الشاشة أو مطابقته."
}
